trial, condition, presented_words, recalled_words
1,normal,"[Z, J, E, Q, G, T, V]","[Z, J, E, Q, G, T, V]"
2,normal,"[S, P, B, J, N, W, Q]","[S, P, B, J, N, Q, W]"
3,normal,"[C, J, I, P, M, D, H]","[C, J, I, M, P, D, H]"
4,normal,"[Y, O, W, Q, D, V, G]","[Y, O, W, Q, G]"
5,normal,"[P, H, A, M, W, C, O]","[P, H, A, M, W, C, O]"
6,suppression,"[B, A, V, E, T, Y, O]","[B, A, V, E, T, Y, O]"
7,suppression,"[H, A, N, R, S, L, E]","[H, A, N, R, S, E]"
8,suppression,"[J, M, A, Y, O, X, I]","[J, M, A, Y, Q, T, O]"
9,suppression,"[Z, G, Q, N, I, S, L]","[Z, G, Q, N, I, L, S]"
10,suppression,"[F, W, J, S, U, L, K]","[F, W, J, Z, Q, E]"
11,tapping,"[S, X, U, P, L, Q, A]","[S, X, U, L, P, Q, A]"
12,tapping,"[Q, D, S, Z, I, A, W]","[Q, D, S, Z, I, A, W]"
13,tapping,"[Y, J, Z, N, R, P, Q]","[Y, J, Z, N, R, Q, P]"
14,tapping,"[L, N, Z, J, X, P, H]","[L, N, Z, J, O, X, W]"
15,tapping,"[Y, V, R, E, C, O, B]","[Y, V, R, E, C, O, P]"
16,normal,"[S, D, K, E, A, H, P]","[S, D, K, E, A, H, P]"
17,normal,"[N, A, Y, O, E, B, V]","[N, A, Y, O, E, V, B]"
18,normal,"[T, B, G, V, Q, N, X]","[T, B, G, V, N, Q, X]"
19,normal,"[D, C, T, E, Z, U, W]","[D, C, T, E, Z, U, W]"
20,normal,"[E, Z, Y, H, Q, V, C]","[E, Z, Y, H, V, Q, C]"
21,normal,"[A, I, L, T, Q, V, Z]","[A, I, L, T, Q, V]"
22,normal,"[P, Y, G, Z, U, O, K]","[P, Y, G, Z, U, K, O]"
23,normal,"[C, E, T, F, X, M, U]","[C, E, T, F, X, M]"
24,normal,"[R, K, Z, W, C, V, Y]","[R, K, Z, W, C, V, Y]"
25,normal,"[J, V, D, L, H, F, P]","[J, V, D, H, L, F, P]"
26,normal,"[U, J, K, Y, B, W, V]","[U, J, K, Y, B, W]"
27,normal,"[X, N, L, E, R, Y, S]","[X, N, L, E, R, Y]"
28,normal,"[R, L, O, X, A, V, F]","[R, L, O, A, V, F]"
29,normal,"[B, H, P, D, J, V, N]","[B, H, P, J, V, N]"
30,normal,"[M, I, S, Z, U, Y, R]","[M, I, S, U, Y, R]"
31,normal,"[D, Q, K, P, O, Y, B]","[D, Q, K, P, Y, B]"
32,normal,"[F, C, S, D, M, O, B]","[F, C, S, M, O, B]"
33,normal,"[O, K, M, A, W, J, Y]","[O, K, M, A, W, Y]"
34,normal,"[K, S, Z, I, G, E, N]","[K, S, Z, I, E, N]"
35,normal,"[G, M, V, D, O, F, P]","[G, M, V, O, F, P]"
36,tapping,"[Z, K, F, R, U, H, V]","[Z, K, F, R, U, H, V]"
37,tapping,"[P, N, D, L, K, E, I]","[P, N, D, L, K, E, I]"
38,tapping,"[F, T, C, I, N, E, O]","[F, T, C, I, N, E, O]"
39,tapping,"[Q, V, L, U, D, T, W]","[Q, V, L, U, D, T, W]"
40,tapping,"[I, X, E, O, P, T, U]","[I, X, E, O, P, T, U]"
41,tapping,"[C, F, T, V, U, O, W]","[C, F, T, V, U, O, W]"
42,tapping,"[X, J, D, S, R, H, A]","[X, J, D, R, S, H, A]"
43,tapping,"[O, S, T, H, I, K, Y]","[O, S, T, H, I, K, Y]"
44,tapping,"[P, D, A, W, J, M, V]","[P, D, A, W, J, M, V]"
45,tapping,"[E, A, I, X, T, C, Y]","[E, A, I, X, T, C, Y]"
46,tapping,"[I, N, H, M, E, S, V]","[I, N, H, M, E, S, V]"
47,tapping,"[O, A, H, I, T, L, S]","[O, A, H, I, T, L, S]"
48,tapping,"[X, I, T, Z, S, O, B]","[X, I, T, Z, S, O, B]"
49,tapping,"[U, W, F, R, V, P, O]","[U, W, F, R, V, P, O]"
50,tapping,"[V, C, N, B, E, Q, M]","[V, C, N, B, E, Q, M]"
51,tapping,"[U, Z, Q, D, T, S, N]","[U, Z, Q, D, T, N, S]"
52,tapping,"[W, Y, V, O, D, C, X]","[W, Y, V, O, D, C, X]"
53,tapping,"[S, U, W, T, Y, M, G]","[S, U, W, T, Y, M, G]"
54,tapping,"[P, A, B, E, C, S, Z]","[P, A, B, E, C, S, Z]"
55,tapping,"[X, E, L, N, B, T, K]","[X, E, L, N, B, T, K]"
56,suppression,"[H, C, K, F, N, U, P]","[H, K, F, N, U, P]"
57,suppression,"[M, Q, J, P, R, C, S]","[M, Q, J, P, R, S]"
58,suppression,"[R, L, A, V, Z, X, Y]","[R, L, A, V, Z, Y]"
59,suppression,"[R, H, W, T, J, O, Q]","[R, H, W, T, O, Q]"
60,suppression,"[W, J, C, R, N, P, F]","[W, J, C, R, P, F]"
61,suppression,"[W, I, E, T, J, G, O]","[W, I, E, T, G, O]"
62,suppression,"[H, Q, A, D, V, C, S]","[H, Q, A, D, C, S]"
63,suppression,"[A, G, M, V, R, X, S]","[A, G, M, R, X, S]"
64,suppression,"[R, S, A, C, U, Z, O]","[R, S, A, U, Z, O]"
65,suppression,"[P, J, C, M, X, K, G]","[P, J, C, M, K, G]"
66,suppression,"[Q, K, T, F, Y, V, U]","[Q, K, T, F, V, U]"
67,suppression,"[W, G, M, L, K, A, X]","[W, G, M, L, A, X]"
68,suppression,"[S, I, W, O, M, E, D]","[S, I, W, O, M, D]"
69,suppression,"[Y, P, W, G, E, R, Q]","[Y, P, W, G, E, Q]"
70,suppression,"[R, B, S, Q, E, C, D]","[R, B, S, Q, C, D]"
71,suppression,"[I, K, A, W, L, Q, D]","[I, K, A, W, Q, D]"
72,suppression,"[X, R, Z, W, V, K, B]","[X, R, Z, W, K, B]"
73,suppression,"[O, P, X, G, Q, W, N]","[O, P, X, G, W, N]"
74,suppression,"[U, E, N, R, I, Z, S]","[U, E, N, R, Z, S]"
75,suppression,"[F, S, A, C, U, K, O]","[F, S, A, C, U, K, O]"
76,chunking,"[G, G, S, R, Y, D, N]","[G, G, S, R, Y, D, N]"
77,chunking,"[N, P, C, S, E, D, V]","[N, P, C, S, E, D, V]"
78,chunking,"[C, A, D, V, D, 4, K]","[C, A, D, V, D, 4, K]"
79,chunking,"[D, K, T, Y, D, I, Y]","[D, K, T, Y, D, Y]"         
80,chunking,"[J, P, G, H, A, C, K]","[J, P, G, H, A, C, K]"          
81,chunking,"[N, G, L, M, R, 4, K]","[N, G, L, M, R, 4, K]"
82,chunking,"[G, L, G, I, F, P, N]","[G, L, G, F, P, N]"          
83,chunking,"[I, R, L, P, W, N, T]","[I, R, L, P, W, N, T]"
84,chunking,"[O, M, G, P, D, F, A]","[O, M, G, P, D, F, A]"
85,chunking,"[U, K, 4, K, C, A, E]","[U, K, 4, K, C, E]"          
86,chunking,"[O, P, B, E, T, A, G]","[O, P, B, E, T, A, G]"
87,chunking,"[T, L, D, R, O, P, M]","[T, L, D, R, O, P, M]"
88,chunking,"[4, K, D, V, D, N, G]","[4, K, D, V, N, G]"        
89,chunking,"[F, R, G, G, U, K, T]","[F, R, G, G, U, K, T]"           
90,chunking,"[Y, O, F, O, M, O, D]","[Y, O, F, O, M, O, D]"
91,chunking,"[M, C, A, V, I, T, R]","[M, C, A, V, I, T, R]"
92,chunking,"[D, E, T, B, H, N, E]","[D, E, T, B, H, N, E]"
93,chunking,"[4, K, W, T, F, W, W]","[4, K, W, T, F, W, W]"
94,chunking,"[M, P, 4, M, S, A, I]","[M, P, 4, M, S, A, I]"
95,chunking,"[I, R, L, T, L, D, R]","[I, R, L, T, L, D, R]"
97,normal,"[Y, W, I, N, B, S, L]","[Y, W, I, N, B, S, L]"
98,normal,"[B, L, R, S, K, M, G]","[B, L, R, S, K, M, G]"
99,normal,"[V, G, W, O, N, M, I]","[V, G, W, O, N, M, I]"
100,normal,"[O, F, P, D, J, K, H]","[O, F, P, D, J, K, H]"
101,normal,"[R, M, E, O, W, I, Q]","[R, M, E, O, W, I, Q]"
102,normal,"[I, Y, C, V, Q, X, L]","[I, Y, C, V, Q, X, L]"
103,normal,"[A, M, Y, C, V, T, U]","[A, M, Y, C, V, T, U]"
104,normal,"[G, L, V, O, U, W, J]","[G, L, V, O, U, W]"
105,normal,"[I, G, Y, J, N, L, O]","[I, G, Y, J, L, N, O]"
106,normal,"[H, A, G, Z, O, V, D]","[H, A, G, Z, O, V, D]"
107,normal,"[W, I, Z, L, H, T, N]","[W, I, Z, L, H, T, N]"
108,normal,"[F, D, O, I, Q, B, G]","[F, D, O, I, Q, B, N]"
109,normal,"[Q, M, N, X, P, F, K]","[Q, X, M, N, F, P, K]"
110,normal,"[P, F, J, Z, U, H, M]","[P, F, J, Z, U, H, M]"
111,normal,"[X, M, G, W, U, K, O]","[X, M, G, W, U, K, O]"
112,normal,"[N, L, Q, K, O, C, Y]","[N, L, Q, K, O, C, Y]"
113,normal,"[N, C, H, I, L, U, G]","[N, C, H, I, L, U, G]"
114,normal,"[V, A, S, Q, U, K, J]","[V, A, S, Q, U, K, J]"
115,normal,"[E, Q, O, I, N, A, M]","[E, Q, O, I, N, A, M]"
116,normal,"[W, B, P, C, M, G, N]","[W, B, P, Q, B, M, N]"
117,tapping,"[C, B, E, H, T, D, Y]","[C, B, E, H, T, D, Y]"
118,tapping,"[O, K, Y, U, E, P, R]","[O, K, Y, U, E, P, R]"
119,tapping,"[P, V, H, M, C, N, Q]","[P, V, H, M, C, N, Q]"
120,tapping,"[Q, O, L, S, W, J, P]","[Q, O, L, S, J, W, P]"
121,tapping,"[D, J, T, Z, M, W, U]","[D, J, T, Z, M, W, U]"
122,tapping,"[Q, K, D, Z, X, C, S]","[Q, K, D, Z, X, C, D]"
123,tapping,"[G, P, T, W, O, C, R]","[G, P, T, W, O, C, R]"
124,tapping,"[D, A, F, O, Y, C, W]","[D, A, F, O, Y, C, W]"
125,tapping,"[Z, Q, S, E, L, R, G]","[Z, Q, S, E, L, R, G]"
126,tapping,"[O, X, V, D, S, B, P]","[O, X, V, D, E, S, P]"
127,tapping,"[B, H, S, V, K, Q, U]","[B, H, S, V, K, G, U]"
128,tapping,"[B, C, Y, A, J, G, K]","[B, C, Y, A, J, G, K]"
129,tapping,"[P, B, D, G, U, F, W]","[B, P, D, G, U, F, W]"
130,tapping,"[R, H, A, D, B, G, Y]","[R, H, A, D, B, G, Y]"
131,tapping,"[S, H, X, Y, C, J, U]","[S, H, X, Y, C, J, U]"
132,tapping,"[B, E, Z, V, H, L, F]","[B, E, V, H, Z, X, L]"
133,tapping,"[F, R, J, G, P, L, Y]","[F, R, J, G, P, L, Y]"
134,tapping,"[M, D, B, U, T, C, P]","[M, D, B, U, T, C, P]"
135,tapping,"[Z, Y, H, D, P, S, B]","[Z, Y, H, D, B, S, P]"
136,tapping,"[P, Q, H, I, R, T, Z]","[P, Q, H, I, R, T, Z]"
137,suppression,"[Z, S, F, I, V, U, H]","[Z, L, S, F, U, V, H]"
138,suppression,"[W, N, Y, X, F, S, K]","[W, N, F, Y, X, E, K]"
139,suppression,"[I, V, C, A, L, G, R]","[I, V, C, A, L, G, H]"
140,suppression,"[Y, Q, X, U, L, K, B]","[Y, G, X, L, B, K]"
141,suppression,"[S, W, F, K, Z, V, G]","[S, F, W, K, L, G, Y]"
142,suppression,"[T, N, O, X, S, H, U]","[T, N, O, X, S, H, U]"
143,suppression,"[S, C, L, V, E, P, Y]","[S, C, E, L, V, Y, P]"
144,suppression,"[A, G, K, J, Z, Y, D]","[A, G, K, J, Z, Y, D]"
145,suppression,"[H, M, K, Y, V, R, F]","[H, L, K, M, Y, R, V]"
146,suppression,"[I, E, Y, L, C, G, S]","[I, E, C, L, Y, G, S]"
147,suppression,"[A, T, E, O, C, K, Q]","[A, T, E, O, C, K, Q]"
148,suppression,"[M, P, Z, G, B, Q, J]","[M, G, Z, P, G, B, E]"
149,suppression,"[K, H, Q, B, S, J, A]","[K, G, Q, B, J, S, L]"
150,suppression,"[D, N, F, W, V, Q, C]","[D, N, F, W, V, Q, C]"
151,suppression,"[C, S, J, Q, X, B, N]","[C, S, J, Q, X, B, N]"
152,suppression,"[R, M, Z, A, T, D, C]","[R, M, Z, A, T, D, B]"
153,suppression,"[B, V, A, F, E, C, S]","[B, F, A, V, S, L, E]"
154,suppression,"[R, O, Z, J, F, A, U]","[R, O, Z, J, F, A, U]"
155,suppression,"[W, Q, V, L, D, B, Z]","[W, E, Z, L, D, B, F]"
156,suppression,"[S, A, V, U, R, Y, P]","[S, A, L, U, R, Y, B]"
157,chunking,"[A, V, I, B, R, B, L]","[A, V, I, B, R, B, L]"
158,chunking,"[D, K, D, N, A, A, S]","[D, K, D, N, A, A, S]"
159,chunking,"[N, E, T, F, P, S, C]","[N, E, T, F, P, S, C]"
160,chunking,"[S, R, Y, T, R, O, L]","[S, R, Y, T, R, O, L]"
161,chunking,"[B, R, B, C, D, M, E]","[B, R, B, C, D, M, E]"
162,chunking,"[N, O, N, P, L, A, G]","[N, O, N, P, L, A, G]"
163,chunking,"[U, S, A, U, K, M, S]","[N, A, U, C, K, M, S]"
164,chunking,"[D, I, Y, Y, O, L, O]","[D, I, Y, Y, O, L, O]"
165,chunking,"[4, K, F, O, M, O, G]","[K, F, K, O, O, M, G]"
166,chunking,"[D, L, C, D, V, D, D]","[D, L, C, D, V, D, D]"
167,chunking,"[D, V, D, F, R, S, M]","[D, V, D, F, R, S, M]"
168,chunking,"[H, A, C, K, W, I, F]","[H, A, C, K, W, I, F]"
169,chunking,"[M, C, N, P, L, M, A]","[M, C, N, P, L, M, A]"
170,chunking,"[W, P, G, I, F, R, A]","[W, P, G, I, F, R, A]"
171,chunking,"[S, R, Y, G, L, D, J]","[S, R, Y, G, L, D, J]"
172,chunking,"[M, P, 4, F, O, M, O]","[M, P, F, M, O, P]"
173,chunking,"[N, E, T, G, I, F, C]","[N, E, T, G, I, F, C]"
174,chunking,"[R, I, P, C, E, O, H]","[R, I, P, C, E, O, H]"
175,chunking,"[Z, I, P, P, N, G, B]","[Z, I, P, P, N, G, B]"
176,chunking,"[P, R, N, G, L, D, I]","[P, R, N, G, L, D, I]"

